{
	"schema_version": 1,
	"id": "lagrangian-and-hamiltonian-mechanics",
	"chapter": "mechanics-and-gravity",
	"title": "Lagrangian and Hamiltonian mechanics",
	"track": "main",
	"depth": "working",
	"status": "physics-reviewed",
	"revision": 2,
	"updated": "2026-09-22",
	"teaches": [
		"generalized-coordinates",
		"calculus-of-variations",
		"fundamental-lemma-calculus-of-variations",
		"euler-lagrange-equation",
		"lagrangian",
		"hamiltons-principle",
		"canonical-momentum",
		"cyclic-coordinate",
		"constant-of-the-motion",
		"hamiltonian",
		"hamiltons-equations",
		"hamilton-jacobi-equation"
	],
	"builds_on": [
		"units-and-dimensions",
		"newtons-laws-and-inertial-frames",
		"rotating-frames",
		"calculus-refresher"
	],
	"summary": "Instead of tracking every force, write one function of the coordinates and their rates of change, and add it up along the path. The path the system takes is the one where nudging it, with its two ends held fixed, leaves that total unchanged at first order. One equation per coordinate follows, in whatever coordinates suit the problem, and every coordinate the function leaves out hands back a quantity that never changes. Trading velocities for momenta turns the law into a flow through the states.",
	"opening": "A brass bob hangs on a light rigid rod half a metre long and swings in one vertical plane. Written Newton's way, the bob has two coordinates, $x$ and $y$ measured from the pivot, and three unknowns: $x$, $y$ and the tension $T$ the rod exerts along its length. Two component equations plus the constraint $x^2 + y^2 = \\ell^2$ close the system, and $T$ has to be carried through every line and discarded at the end.\n\nNobody wanted the tension. The rod's only job was to hold the length fixed. This section rebuilds mechanics so that the rod's job is done once, by the choice of coordinate, and the tension never appears. The same rebuilding turns symmetries into conserved quantities, puts a flow on the space of states, and compresses the whole motion into one partial differential equation. Each of those returns in general relativity, where free fall is itself a stationary-action law.",
	"parts": [
		{
			"id": "coordinates-that-fit-the-system",
			"heading": "Coordinates that fit the system",
			"teaches": [
				"generalized-coordinates"
			],
			"text": "Start by counting. A system's configuration is the list of where all its parts are at one instant, and the number of independent numbers needed to fix that list is its number of degrees of freedom, $n$. The swinging bob needs one, the angle $\\theta$ measured from the downward vertical in the plane of the swing. A bead threaded on a fixed wire needs one, the distance along the wire. Two particles held apart by a rigid rod need five. This counting works when every constraint can be written as an equation among the positions, as the rod's can; a constraint that restricts velocities without restricting positions, such as a ball rolling on a table without slipping, needs machinery beyond this section.\n\nAny $n$ independent quantities $q^1, \\dots, q^n$ that fix the configuration are called generalized coordinates, written $q^a$ with a Latin index $a$ running from $1$ to $n$. They need not be lengths. An angle, an area, or the charge that has passed a point all serve. Their time derivatives $\\dot q^a = dq^a/dt$ are the generalized velocities, and the set of all configurations is the configuration space, in which a motion is a curve $q^a(t)$.\n\nChoosing coordinates that already obey the constraints is the first saving. The rod fixes $x^2 + y^2 = \\ell^2$; writing $x = \\ell\\sin\\theta$ and $y = -\\ell\\cos\\theta$ builds that in, so no equation ever needs the tension. When the forces come from a potential energy $V(q)$, as *Newton's laws and inertial frames* defines it, the quantity $Q_a = -\\partial V/\\partial q^a$ is the generalized force conjugate to $q^a$. Its units are whatever makes the product $Q_a\\,\\delta q^a$ an energy, so the generalized force conjugate to an angle is a torque, measured in newton metres.",
			"takeaway": "A system with n degrees of freedom can be described by any n independent generalized coordinates, and choosing ones that already obey the constraints removes the constraint forces before the calculation begins."
		},
		{
			"id": "wiggling-a-path-with-pinned-ends",
			"heading": "Wiggling a path with its ends pinned",
			"teaches": [
				"calculus-of-variations",
				"fundamental-lemma-calculus-of-variations"
			],
			"text": "A rule that swallows a whole function and returns one number is a functional. The length of a curve $y(x)$ between two fixed points, $I[y] = \\int_{x_1}^{x_2}\\sqrt{1 + y'^2}\\,dx$, is one. Finding the function that makes a functional stationary is the calculus of variations.\n\nTake any functional $I[y] = \\int_{x_1}^{x_2} F(y, y', x)\\,dx$ with the end values $y(x_1)$ and $y(x_2)$ held fixed. Compare a candidate $y$ with the neighbour $y + \\epsilon\\eta$, where $\\epsilon$ is a number and $\\eta(x)$ is any bump with a continuous derivative that vanishes at both ends, so the neighbour keeps the same end values. Feeding the neighbour into the functional gives one number for each $\\epsilon$; write it $I(\\epsilon) = I[y + \\epsilon\\eta]$, an ordinary function of one variable. The candidate is called stationary when $dI/d\\epsilon = 0$ at $\\epsilon = 0$ for every such $\\eta$. Write $\\delta y = \\epsilon\\eta$ and call it the variation. It is the gap between two rival curves at the same $x$, not anything the system does as $x$ advances, so pinning it at the ends restricts which curves compete and says nothing about slopes there. The first-order change is\n\n$$\\delta I = \\int_{x_1}^{x_2}\\left(\\frac{\\partial F}{\\partial y}\\,\\delta y + \\frac{\\partial F}{\\partial y'}\\,\\delta y'\\right) dx .$$\n\nThe second term still carries a derivative of the variation, so integrate it by parts:\n\n$$\\int_{x_1}^{x_2}\\frac{\\partial F}{\\partial y'}\\,\\delta y'\\,dx = \\left[\\frac{\\partial F}{\\partial y'}\\,\\delta y\\right]_{x_1}^{x_2} - \\int_{x_1}^{x_2}\\frac{d}{dx}\\!\\left(\\frac{\\partial F}{\\partial y'}\\right)\\delta y\\,dx .$$\n\nThe bracket vanishes because $\\delta y$ vanishes at both ends. That is the entire reason the ends were pinned.\n\nWhat survives is $\\int_{x_1}^{x_2}\\phi(x)\\,\\delta y(x)\\,dx = 0$ for every admissible variation, with $\\phi = \\partial F/\\partial y - (d/dx)(\\partial F/\\partial y')$. The fundamental lemma of the calculus of variations says a continuous $\\phi$ with that property is zero everywhere. Its proof traps the function: if $\\phi(\\xi) > 0$ then, by continuity, $\\phi > 0$ on some interval $(\\xi_1, \\xi_2)$ around $\\xi$, and $\\delta y = (x - \\xi_1)^4(x - \\xi_2)^4$ inside that interval, zero outside, has a continuous derivative everywhere and vanishes at both ends, so it is one of the admissible variations, and it makes the integral strictly positive. That contradiction, with signs reversed too, leaves $\\phi = 0$ everywhere.",
			"takeaway": "Pinning the ends lets integration by parts move every derivative off the variation, and the fundamental lemma then converts one vanishing integral into a condition that must hold at every point of the path."
		},
		{
			"id": "the-euler-lagrange-equation",
			"heading": "The Euler-Lagrange equation",
			"teaches": [
				"euler-lagrange-equation"
			],
			"text": "Setting $\\phi = 0$ gives the Euler-Lagrange equation,\n\n$$\\frac{d}{dx}\\left(\\frac{\\partial F}{\\partial y'}\\right) = \\frac{\\partial F}{\\partial y} ,$$\n\na second-order ordinary differential equation for $y(x)$, with two constants of integration for the two end values to fix. Fixing them is not the same as starting from a position and a velocity: for some pairs of ends there is more than one stationary curve, and for some there is none. When several functions $y^1(x), \\dots, y^n(x)$ are varied, each variation $\\delta y^a$ can be chosen independently with the others set to zero, so the lemma applies once per function: there is one Euler-Lagrange equation for each.\n\nTest it on the shortest curve in a plane, $F = \\sqrt{1 + y'^2}$. Here $F$ contains no $y$, so the right-hand side is zero and $\\partial F/\\partial y' = y'/\\sqrt{1 + y'^2}$ is constant along the curve. That function of $y'$ is strictly increasing, so $y'$ itself is constant and the curve is a straight line. Whenever $F$ lacks one of the functions $y^a$, the matching derivative $\\partial F/\\partial y'^a$ keeps the same value all along the solution.\n\nOne warning belongs here. Only the first-order change was used, so a solution is stationary; whether it is a minimum, a maximum or a saddle of $I$ is settled by the second-order change, and all three cases occur.",
			"takeaway": "Requiring an integral to be stationary between fixed ends gives one second-order Euler-Lagrange equation for each function varied, and it finds stationary curves only, not necessarily shortest or smallest ones."
		},
		{
			"id": "the-action-and-hamiltons-principle",
			"heading": "The action and Hamilton's principle",
			"teaches": [
				"lagrangian",
				"hamiltons-principle"
			],